{
  "model_id": "educational-rbf-gp",
  "version": "1",
  "target": "Latent synthetic scalar function on [0,1]",
  "valid_domain": [
    "Synthetic [0,1] only"
  ],
  "observation_operator": "Identity plus known independent Gaussian noise",
  "training_manifest": "examples/results/runs.json",
  "prior_assumptions": [
    "Stationary RBF kernel, fixed length scale 0.18",
    "Noise SD 0.06, fixed hyperparameters"
  ],
  "identifiability_status": "unchecked",
  "uncertainty_scope": [
    "latent_function"
  ],
  "validation_status": "synthetic_only",
  "limitations": [
    "Not a biological model",
    "No hyperparameter or kernel selection",
    "Empirical pointwise coverage is not a guarantee"
  ]
}
